account-seq,bureau-code,treasury-code,account_name,account-deleted
0,25,16-4601,Working Capital Fund,N
0,SP,,GENERAL FUND RECEIPT ACCOUNTS,N
0,SP,,GENERAL PROVISIONS,N
0,SP,,TITLE V—GENERAL PROVISIONS,N
0,00,19-143500,"General Fund Proprietary Interest Receipts, not Otherwise Classified",N
0,00,19-277630,"Repatriation Loans, Downward Reestimate of Subsidies",N
0,00,19-322000,All Other General Fund Proprietary Receipts Including Budget Clearing Accounts,N
0,00,19-388500,Undistributed Intragovernmental Payments and Receivables from Cancelled Accounts,N
0,00,19-515110,"International Center, Washington, D.C., Sale and Rent of Real Property",N
0,00,19-517710,International Litigation Fund,N
0,00,19-549710,"Employing Agency Contributions, Foreign Service National Defined Contributions Retirement Fund",N
0,00,19-549720,"Interest on Investments, Foreign Service National Defined Contributions Retirement Fund",N
0,00,20-083000,"Immigration, Passport, and Consular Fees",N
0,00,19-816720,"Contributions, Educational and Cultural Exchange, USIA",N
0,00,19-818610,"Deductions from Employees Salaries, Foreign Service Retirement and Disability Fund",N
0,00,19-818620,"Interest on Investments, Foreign Service Retirement and Disability Fund",N
0,00,19-818640,"Employing Agency Contributions, Foreign Service Retirement and Disability Fund",N
0,00,19-818650,"Receipts from Civil Service Retirement and Disability Fund, Foreign Service Retirement and Disability Fund",N
0,00,19-818680,"Federal Contributions, Foreign Service Retirement and Disability Fund",N
0,00,19-834010,Foreign Service National Separation Liability Trust Fund,N
0,00,19-881310,"Payments from Federal Funds, International Center for Middle Eastern-Western Dialogue Trust Fund",N
0,00,19-881320,"Earnings on Investments, International Center for Middle Eastern-Western Dialogue Trust Fund",N
0,00,19-882110,Unconditional Gift Fund,N
0,00,19-882120,"Earnings on Investments, Unconditional Gift Fund",N
0,00,19-882210,"Deposits, Conditional Gift Fund",N
0,00,19-977120,"Interest, Miscellaneous Trust Funds, USIA",N
0,00,95-827620,Earnings on Investments,N
0,05,19-0113,Diplomatic and Consular Programs,N
0,05,19-0201,International Information Programs,N
0,05,19-0121,Conflict Stabilization Operations,N
0,05,19-0120,Capital Investment Fund,N
0,05,19-0529,Office of the Inspector General,N
0,05,19-0209,Educational and Cultural Exchange Programs,N
0,05,19-0535,"Embassy Security, Construction, and Maintenance",N
0,05,19-0545,Representation Allowances,N
0,05,19-0520,Protection of Foreign Missions and Officials,N
0,05,19-0522,Emergencies in the Diplomatic and Consular Service,N
0,05,19-0524,Buying Power Maintenance,N
0,05,19-0523,Payment to the American Institute in Taiwan,N
0,05,19-0540,Payment to Foreign Service Retirement and Disability Fund,N
0,05,19-5497,Foreign Service National Defined Contributions Retirement Fund,N
0,05,19-4519,Working Capital Fund,N
0,05,19-0601,Repatriation Loans Program Account,N
0,05,19-4107,Repatriation Loans Financing Account,N
0,05,19-8186,Foreign Service Retirement and Disability Fund,N
0,05,19-8340,Foreign Service National Separation Liability Trust Fund,N
0,05,19-9971,Miscellaneous Trust Funds,N
0,10,19-1126,Contributions to International Organizations,N
0,10,19-1124,Contributions for International Peacekeeping Activities,N
0,15,19-1069,"Salaries and Expenses, IBWC",N
0,15,19-1078,"Construction, IBWC",N
0,15,19-1082,"American Sections, International Commissions",N
0,15,19-1087,International Fisheries Commissions,N
0,25,19-1030,Global HIV/AIDs Initiative,N
0,25,19-1031,Global Health Programs,N
0,25,19-1143,Migration and Refugee Assistance,N
0,25,19-1155,Payment to International Center for Middle Eastern-Western Dialogue Trust Fund,N
0,25,11-0040,United States Emergency Refugee and Migration Assistance Fund,N
0,25,72-1015,Complex Crises Fund,N
0,25,19-1022,International Narcotics Control and Law Enforcement,N
0,25,19-1154,Andean Counterdrug Programs,N
0,25,19-1121,Democracy Fund,N
0,25,19-0525,Payment to the Asia Foundation,N
0,25,19-0210,National Endowment for Democracy,N
0,25,19-0202,East-West Center,N
0,25,19-5177,International Litigation Fund,N
0,25,19-5151,"International Center, Washington, D.C.",N
0,25,19-5116,Fishermen's Protective Fund,N
0,25,19-5121,Fishermen's Guaranty Fund,N
0,25,95-8276,Israeli Arab and Eisenhower Exchange Fellowship Programs,N
0,25,19-8813,Center for Middle Eastern-Western Dialogue Trust Fund,N
0,SP,,GENERAL FUND RECEIPT ACCOUNTS,N
0,00,11-267130,"New Arrangements to Borrow (IMF), Downward Reestimates of Subsidies",N
0,00,11-267230,"International Monetary Fund Quota, Downward Reestimates of Subsidies",N
0,03,95-322077,All Other General Fund Proprietary Receipts Including Budget Clearing Accounts,N
0,03,95-388577,Undistributed Intragovernmental Payments and Receivables from Cancelled Accounts,N
0,03,95-2750,Millennium Challenge Corporation,N
0,05,11-272430,"Foreign Military Financing, Downward Reestimates of Subsidies",N
0,05,72-1037,Economic Support Fund,N
0,05,72-1096,Central America and Caribbean Emergency Disaster Recovery Fund,N
0,05,11-1082,Foreign Military Financing Program,N
0,05,11-1083,Pakistan Counterinsurgency Capability Fund,N
0,05,11-1081,International Military Education and Training,N
0,05,72-1032,Peacekeeping Operations,N
0,05,11-2300,Conflict Response Fund,N
0,05,11-1075,"Nonproliferation, Antiterrorism, Demining, and Related Programs",N
0,05,11-1071,Nonproliferation and Disarmament Fund,N
0,05,11-1085,Foreign Military Financing Loan Program Account,N
0,05,11-4122,Foreign Military Financing Direct Loan Financing Account,N
0,05,11-4121,Foreign Military Loan Liquidating Account,N
0,05,11-4174,Military Debt Reduction Financing Account,N
0,10,11-272330,"Debt Restructuring, Downward Reestimates of Subsidies",N
0,10,11-0080,Clean Technology Fund,N
0,10,11-1475,Global Food Security Fund,N
0,10,11-0077,Contribution to the International Bank for Reconstruction and Development,N
0,10,11-0073,Contribution to the International Development Association,N
0,10,11-0084,Contribution to Multilateral Investment Guarantee Agency,N
0,10,11-0072,Contribution to the Inter-American Development Bank,N
0,10,11-0076,Contribution to the Asian Development Bank,N
0,10,11-0079,Contribution to the African Development Bank,N
0,10,11-0088,Contribution to the European Bank for Reconstruction and Development,N
0,10,11-1008,North American Development Bank,N
0,10,11-0089,Contribution to Enterprise for the Americas Multilateral Investment Fund,N
0,10,11-1039,Contributions to the International Fund for Agricultural Development,N
0,10,11-1045,International Affairs Technical Assistance Program,N
0,10,72-1028,"Global Fund to Fight AIDS, Tuberculosis and Malaria",N
0,10,72-1005,International Organizations and Programs,N
0,10,11-0091,Debt Restructuring,N
0,15,72-143500,"General Fund Proprietary Interest Receipts, not Otherwise Classified",N
0,15,72-272530,"Loan Guarantees to Israel, Downward Reestimates of Subsidies",N
0,15,72-273030,"Microenterprise and Small Enterprise Development, Downward Reestimates of Subsidies",N
0,15,72-274430,"Urban and Environmental Credit Program, Downward Reestimates of Subsidies",N
0,15,72-275230,"Development Credit Authority Program Account, Downward Reestimates of Loan Guarantees",N
0,15,72-278530,"Loan Guarantees to Egypt, Downward Reestimates of Subsidies",N
0,15,72-294100,"Dollar Repayments of Loans, Agency for International Development",N
0,15,72-304200,Recoveries from various enterprise funds,N
0,15,72-322000,All Other General Fund Proprietary Receipts Including Budget Clearing Accounts,N
0,15,72-388500,Undistributed Intragovernmental Payments and Receivables from Cancelled Accounts,N
0,15,72-1021,Development Assistance Program,N
0,15,72-1095,Child Survival and Health Programs,N
0,15,72-1033,HIV/AIDS Working Capital Fund,N
0,15,72-1014,Development Fund for Africa,N
0,15,72-0306,"Assistance for Europe, Eurasia and Central Asia",N
0,15,72-1010,Assistance for Eastern Europe and the Baltic States,N
0,15,72-1093,Assistance for the Independent States of the Former Soviet Union,N
0,15,72-1035,International Disaster Assistance,N
0,15,72-1000,Operating Expenses of the Agency for International Development,N
0,15,72-0300,Capital Investment Fund of the United States Agency for International Development.,N
0,15,72-1027,Transition Initiatives,N
0,15,72-1036,Payment to the Foreign Service Retirement and Disability Fund,N
0,15,72-0305,Conflict Stabilization Operations,N
0,15,72-1007,"Operating Expenses, Office of Inspector General",N
0,15,72-4175,Property Management Fund,N
0,15,72-4513,Working Capital Fund,N
0,15,72-4137,Debt Reduction Financing Account,N
0,15,72-0301,Loan Guarantees to Israel Program Account,N
0,15,72-4119,Loan Guarantees to Israel Financing Account,N
0,15,72-0304,Loan Guarantees to Egypt Program Account,N
0,15,72-4491,Loan Guarantees to Egypt Financing Account,N
0,15,72-0409,Tunisia Loan Guarantee Program Account,N
0,15,72-0401,Urban and Environmental Credit Program Account,N
0,15,72-4344,Urban and Environmental Credit Guaranteed Loan Financing Account,N
0,15,72-4340,Housing and Other Credit Guaranty Programs Liquidating Account,N
0,15,72-0400,Microenterprise and Small Enterprise Development Program Account,N
0,15,72-4343,Microenterprise and Small Enterprise Development Guaranteed Loan Financing Account,N
0,15,72-4341,Private Sector Revolving Fund Liquidating Account,N
0,15,72-1264,Development Credit Authority Program Account,N
0,15,72-4266,Development Credit Authority Guaranteed Loan Financing Account,N
0,15,72-4492,Development Credit Authority Direct Loan Financing Account,N
0,15,72-4103,Economic Assistance Loans Liquidating Account,N
0,15,72-834210,Foreign Service National Separation Liability Trust Fund,N
0,15,72-882410,"Gifts and Donations, Agency for International Development",N
0,15,72-8342,Foreign Service National Separation Liability Trust Fund,N
0,15,72-9971,"Miscellaneous Trust Funds, AID",N
0,20,71-274910,"Overseas Private Investment Corporation Loans, Negative Subsidies",N
0,20,71-274930,"Overseas Private Investment Corporation Loans, Downward Reestimates of Subsidy",N
0,20,71-4184,Overseas Private Investment Corporation Noncredit Account,N
0,20,71-0100,Overseas Private Investment Corporation Program Account,N
0,20,71-4074,Overseas Private Investment Corporation Direct Loan Financing Account,N
0,20,71-4075,Overseas Private Investment Corporation Guaranteed Loan Financing Account,N
0,20,71-4030,Overseas Private Investment Corporation Liquidating Account,N
0,25,11-1001,Trade and Development Agency,N
0,35,11-388044,All Other General Fund Proprietary Receipts Including Budget Clearing Accounts,N
0,35,11-539510,"Agency Contributions, Host Country Resident Contractors Separation Liability Fund",N
0,35,11-0100,Peace Corps,N
0,35,11-0101,Foreign Currency Fluctuations,N
0,35,11-5395,Host Country Resident Contractors Separation Liability Fund,N
0,35,11-997200,"Miscellaneous Trust Funds, Peace Corps",N
0,35,11-9972,Peace Corps Miscellaneous Trust Fund,N
0,40,11-3100,Inter-American Foundation,N
0,50,11-0700,African Development Foundation,N
0,50,11-823910,"Gifts and Donations, African Development Foundation",N
0,50,11-8239,"Gifts and Donations, African Development Foundation",N
0,60,11-0003,"United States Quota, International Monetary Fund",N
0,60,11-0006,United States Quota IMF Direct Loan Program Account,N
0,60,11-4383,"United States IMF Quota, Direct Loan Financing Account",N
0,60,11-0074,Loans to International Monetary Fund,N
0,60,11-0085,Loans to the IMF Direct Loan Program Account,N
0,60,11-4384,Loans to IMF Direct Loan Financing Account,N
0,70,11-4116,Special Defense Acquisition Fund,N
0,70,11-824210,"Deposits, Advances, Foreign Military Sales Trust Fund",N
0,70,11-8242,Foreign Military Sales Trust Fund,N
0,75,72-1029,Tsunami Recovery and Reconstruction Fund,N
0,75,72-1038,Central American Reconciliation Assistance,N
0,95,95-9500,Out-year Foreign Assistance Initiatives,N
0,SP,,GENERAL FUND RECEIPT ACCOUNTS,N
0,SP,,GENERAL PROVISIONS,N
0,00,69-085500,"Hazardous Materials Transportation Registration, Filing, and Permit Fees, Administrative Costs",N
0,00,69-143500,"General Fund Proprietary Interest Receipts, not Otherwise Classified",N
0,00,69-272830,"Maritime (title XI) Loan Program, Downward Reestimates of Subsidies",N
0,00,69-273930,"Minority Business Resource Center Loans, Downward Reestimates of Subsidies",N
0,00,69-276010,"Railroad Rehabilitation and Improvement Financing, Negative Subsidies",N
0,00,69-276030,"Downward Reestimates, Railroad Rehabilitation and Improvement Program",N
0,00,69-276830,"Transportation Infrastructure Finance and Innovation Program, Interest on Downward Reestimates",N
0,00,69-309900,"Miscellaneous Recoveries and Refunds, not Otherwise Classified",N
0,00,69-322000,All Other General Fund Proprietary Receipts Including Budget Clearing Accounts,N
0,00,69-388500,Undistributed Intragovernmental Payments and Receivables from Cancelled Accounts,N
0,00,69-517200,Pipeline Safety Fund,N
0,00,69-517210,Pipeline Safety Design Review Fund,N
0,00,69-517220,Pipeline Safety Special Permit Fund,N
0,00,69-517230,Hazardous Materials Approvals and Permits Fund,N
0,00,69-528210,"Hazardous Materials Transportation Registration, Filing, and Permit Fees, Emergency Preparedness Grants",N
0,00,69-542240,"Aviation User Fees, Overflight Fees",N
0,00,69-556010,"Agency Contributions, Port of Guam Improvement Enterprise Fund",N
0,00,69-0160,Immediate Transportation Investments,N
0,00,69-805410,"Advances from State Cooperating Agencies and Foreign Governments, FHA Miscellaneous Trust",N
0,00,69-805420,"Advances from Other Federal Agencies, FHA Miscellaneous Trust",N
0,00,69-810210,"Transportation Trust Fund, Deposits (highway Account)",N
0,00,69-810211,"Transportation Trust Fund, Deposits (Mass Transit Account)",N
0,00,69-810213,"Payment from the General Fund, Transportation Trust Fund (Mass Transit)",N
0,00,69-810214,"CMIA Interest, Highway Trust Fund (highway Account)",N
0,00,69-810215,"CMIA Interest, Highway Trust Fund (mass Transit Account)",N
0,00,69-810220,"Earnings on Investments, Transportation Trust Fund",N
0,00,69-810226,"Transportation Infrastructure Finance and Innovation Program, Downward Reestimates of Subsidies (FHWA)",N
0,00,69-810234,"Payment from the General Fund, Transportation Trust  Fund (Highway)",N
0,00,69-810235,"Payment from the General Fund, Transportation Trust Fund (multimodal Account)",N
0,00,69-810310,"Excise Taxes, Airport and Airway Trust Fund",N
0,00,69-810320,"Interest, Airport and Airway Trust Fund",N
0,00,69-810350,"Refunds from Federal Fund Payments, Airport and Airway Trust Fund",N
0,00,69-810370,Airport and Airway Trust Fund - Air Traffic Service Fee Receipts,N
0,00,69-810810,"Royalties, Research, Engineering, and Development (Airport and Airway Trust Fund)",N
0,00,69-826410,"Advances for Highway Research Program, Miscellaneous Trust",N
0,00,69-826510,"Contributions from States, Etc., Cooperative Work, Forest Highways, FHA, Miscellaneous Trust",N
0,00,69-837110,"Deposits for Cooperative Work, International Highway Transportation Outreach Program",N
0,00,69-850310,"Gifts and Bequests, Maritime Administration, Transportation",N
0,00,69-854710,"Special Studies, Services and Projects, Maritime Administration, Transportation",N
0,00,69-977110,"Proprietary Receipts, Miscellaneous Trust Funds",N
0,04,69-1730,Research and Development,N
0,04,69-0102,Salaries and Expenses,N
0,04,69-0143,National Infrastructure Investments,N
0,04,69-4522,"Working Capital Fund, Volpe National Transportation Systems Center",N
0,04,69-0106,"Supplemental Discretionary Grants for a National Surface Transportation System, Recovery Act",N
0,04,69-0118,Office of Civil Rights,N
0,04,69-0119,Minority Business Outreach,N
0,04,69-0147,New Headquarters Building,N
0,04,69-0111,Compensation for Air Carriers,N
0,04,69-0156,Compensation for General Aviation Operations,N
0,04,69-0142,"Transportation Planning, Research, and Development",N
0,04,69-5423,Essential Air Service and Rural Airport Improvement Fund,N
0,04,69-4520,Working Capital Fund,N
0,04,69-0155,Minority Business Resource Center Program,N
0,04,69-4186,Minority Business Resource Center Direct Loan Financing Account,N
0,04,69-4082,Minority Business Resource Center Guaranteed Loan Financing Account,N
0,04,69-8372,National Infrastructure Investments (Transportation Trust Fund),N
0,04,69-8304,Payments to Air Carriers,N
0,04,,ADMINISTRATIVE PROVISIONS,N
0,12,69-1301,Operations,N
0,12,69-1304,"Facilities and Equipment, Recovery Act",N
0,12,69-1306,"Grants-in-aid for Airports, Recovery Act",N
0,12,69-5422,Aviation User Fees,N
0,12,69-4120,Aviation Insurance Revolving Fund,N
0,12,69-4562,Administrative Services Franchise Fund,N
0,12,69-8103,Airport and Airway Trust Fund,N
0,12,69-8106,Grants-in-aid for Airports (Airport and Airway Trust Fund),N
0,12,69-8107,Facilities and Equipment (Airport and Airway Trust Fund),N
0,12,69-8108,"Research, Engineering and Development (Airport and Airway Trust Fund)",N
0,12,69-8104,Trust Fund Share of FAA Activities (Airport and Airway Trust Fund),N
0,12,,ADMINISTRATIVE PROVISIONS,N
0,15,69-9911,Miscellaneous Appropriations,N
0,15,69-0500,Emergency Relief Program,N
0,15,69-0640,Appalachian Development Highway System,N
0,15,69-0549,State Infrastructure Banks,N
0,15,69-0504,"Highway Infrastructure Investment, Recovery Act",N
0,15,69-0534,Payment to the Transportation Trust Fund,N
0,15,69-4123,Transportation Infrastructure Finance and Innovation Program Direct Loan Financing Account,N
0,15,69-4145,Transportation Infrastructure Finance and Innovation Program Loan Guarantee Financing Account,N
0,15,69-4173,Transportation Infrastructure Finance and Innovation Program Line of Credit Financing Account,N
0,15,69-0542,"TIFIA General Fund Program Account, Federal Highway Administration, Transportation",N
0,15,69-4348,"TIFIA General Fund Direct Loan Financing Account, Federal Highway Administration, Transportation",N
0,15,69-4347,"Tiger TIFIA Direct Loan Financing Account, Recovery Act",N
0,15,69-0548,Highway Infrastructure Programs,N
0,15,69-8402,Right-of-way Revolving Fund Liquidating Account,N
0,15,69-8102,Transportation Trust Fund,N
0,15,69-8083,Federal-aid Highways,N
0,15,69-8072,Appalachian Development Highway System (Transportation Trust Fund),N
0,15,69-9971,Miscellaneous Trust Funds,N
0,15,69-9972,Miscellaneous Transportation Trust Funds,N
0,15,,ADMINISTRATIVE PROVISIONS,N
0,17,69-8055,Motor Carrier Safety,N
0,17,69-8048,National Motor Carrier Safety Program,N
0,17,69-8158,Motor Carrier Safety Grants,N
0,17,69-8159,Motor Carrier Safety Operations and Programs,N
0,17,,ADMINISTRATIVE PROVISIONS,N
0,18,69-0654,Consumer Assistance to Recycle and Save Program,N
0,18,69-0650,Operations and Research,N
0,18,69-0660,National Driver Register Modernization,N
0,18,69-8352,"Operations and Research, Vehicle Safety",N
0,18,69-8016,Operations and Research (Transportation Trust Fund),N
0,18,69-8020,Highway Traffic Safety Grants,N
0,18,,ADMINISTRATIVE PROVISIONS,N
0,27,69-0700,Safety and Operations,N
0,27,69-0745,Railroad Research and Development,N
0,27,69-0723,Pennsylvania Station Redevelopment Project,N
0,27,69-0730,Alaska Railroad Rehabilitation,N
0,27,69-0704,Grants to the National Railroad Passenger Corporation,N
0,27,69-0121,Operating Subsidy Grants to the National Railroad Passenger Corporation,N
0,27,69-0125,Capital and Debt Service Grants to the National Railroad Passenger Corporation,N
0,27,69-0124,Emergency Railroad Rehabilitation and Repair,N
0,27,69-0120,Efficiency Incentive Grants to the National Railroad Passenger Corporation,N
0,27,69-0715,Intercity Passenger Rail Grant Program,N
0,27,69-0719,Capital Assistance for High Speed Rail Corridors and Intercity Passenger Rail Service,N
0,27,69-0722,Next Generation High-speed Rail,N
0,27,69-0123,Northeast Corridor Improvement Program,N
0,27,69-0716,Rail Line Relocation and Improvement Program,N
0,27,69-0701,Railroad Safety Technology Program,N
0,27,69-0750,Railroad Rehabilitation and Improvement Program,N
0,27,69-4288,RRIF Guaranteed Loan Financing Account,N
0,27,69-4420,Railroad Rehabilitation and Improvement Direct Loan Financing Account,N
0,27,69-4411,Railroad Rehabilitation and Improvement Liquidating Account,N
0,27,,ADMINISTRATIVE PROVISIONS,N
0,36,69-1130,"Formula and Bus Grants, General Fund Share",N
0,36,69-1120,Administrative Expenses,N
0,36,69-1129,Formula Grants,N
0,36,69-1136,University Transportation Research,N
0,36,69-2807,Technical Assistance and Workforce Development,N
0,36,69-2808,Rail Transit Safety Oversight Program,N
0,36,69-1137,Research and University Research Centers,N
0,36,69-1125,Job Access and Reverse Commute Grants,N
0,36,69-1134,Capital Investment Grants,N
0,36,69-1131,Grants for Energy Efficiency and Greenhouse Gas Reductions,N
0,36,69-1102,"Fixed Guideway Infrastructure Investment, Recovery Act",N
0,36,69-1101,"Transit Capital Assistance, Recovery Act",N
0,36,69-1121,"Research, Training, and Human Resources",N
0,36,69-1127,Interstate Transfer Grants-transit,N
0,36,69-1128,Washington Metropolitan Area Transit Authority,N
0,36,69-1122,Miscellaneous Expired Accounts,N
0,36,69-8191,"Discretionary Grants (Transportation Trust Fund, Mass Transit Account)",N
0,36,69-8543,Transit Expansion and Livable Communities Programs,N
0,36,69-8544,Bus and Rail State of Good Repair,N
0,36,69-8545,"Transit Challenge Grants, Trust Fund",N
0,36,69-8542,Research and Technology Deployment,N
0,36,69-8540,Operations and Safety,N
0,36,69-8301,Greenhouse Gas and Energy Reduction,N
0,36,69-8350,Transit Formula Grants,N
0,36,,ADMINISTRATIVE PROVISIONS,N
0,40,69-4089,Saint Lawrence Seaway Development Corporation,N
0,40,69-8003,Operations and Maintenance,N
0,50,69-0104,Research and Special Programs,N
0,50,69-1401,Hazardous Materials Safety,N
0,50,69-1400,Operational Expenses,N
0,50,69-5172,Pipeline Safety,N
0,50,69-5282,Emergency Preparedness Grants,N
0,50,69-8121,Trust Fund Share of Pipeline Safety,N
0,50,,ADMINISTRATIVE PROVISIONS,N
0,56,69-0130,Salaries and Expenses,N
0,61,69-0301,Salaries and Expenses,N
0,70,69-1750,Operations and Training,N
0,70,69-1770,Assistance to Small Shipyards,N
0,70,69-1768,Ship Disposal,N
0,70,69-1711,Maritime Security Program,N
0,70,69-1769,National Defense Tank Vessel Construction Program,N
0,70,69-1708,Ship Construction,N
0,70,69-1709,Operating-differential Subsidies,N
0,70,69-1751,Ocean Freight Differential,N
0,70,69-1710,Ready Reserve Force,N
0,70,69-4303,Vessel Operations Revolving Fund,N
0,70,69-4302,War Risk Insurance Revolving Fund,N
0,70,69-5560,Port of Guam Improvement Enterprise Fund,N
0,70,69-4301,Federal Ship Financing Fund Liquidating Account,N
0,70,69-1752,Maritime Guaranteed Loan (title XI) Program Account,N
0,70,69-4304,Maritime Guaranteed Loan (title XI) Financing Account,N
0,70,69-8547,"Miscellaneous Trust Funds, Maritime Administration",N
0,70,,ADMINISTRATIVE PROVISIONS,N
0,SP,,GENERAL FUND RECEIPT ACCOUNTS,N
0,SP,,GENERAL PROVISIONS—DEPARTMENT OF TRANSPORTATION,N
0,SP,,GENERAL PROVISIONS—THIS ACT,N
0,00,10-086400,"Filing Fees, P.L. 109–171, Title X",N
0,00,13-141000,"Interest on Investment, Economic Development Revolving Fund",N
0,00,14-142400,"Interest on Investment, Colorado River Projects",N
0,00,14-142700,"Interest on Advances to Colorado River Dam Fund, Boulder Canyon Project",N
0,00,20-040100,"Proceeds from Exercise of Warrants, Air Transportation Stabilization Board",N
0,00,20-065000,"Deposit of Earnings, Federal Reserve System",N
0,00,20-085000,"Registration, Filing, and Transaction Fees",N
0,00,20-086100,"Charges for Expenses, Settlement of International Claims",N
0,00,20-086900,"Fees for Legal and Judicial Services, not Otherwise Classified",N
0,00,20-089100,"Miscellaneous Fees for Regulatory and Judicial Services, not Otherwise Classified",N
0,00,20-101000,"Fines, Penalties, and Forfeitures, Agricultural Laws",N
0,00,20-102000,"Fines, Penalties, and Forfeitures, Economic Stabilization Laws",N
0,00,20-103000,"Fines, Penalties, and Forfeitures, Immigration and Labor Laws",N
0,00,20-104000,"Fines, Penalties, and Forfeitures, Customs, Commerce, and Antitrust Laws",N
0,00,20-105000,"Fines, Penalties, and Forfeitures, Narcotic Prohibition and Alcohol Laws",N
0,00,20-106000,Forfeitures of Unclaimed Money and Property,N
0,00,20-108000,"Fines, Penalties, and Forfeitures, Federal Coal Mine Health and Safety Laws",N
0,00,20-109600,Penalties on Employers Who Do not Offer Health Coverage or Delay Eligibility for New Employees,N
0,00,20-109700,Penalties on Individuals Who Do not Have Health Coverage,N
0,00,20-113000,Unclaimed Assets Recovery Account,N
0,00,20-129900,"Gifts to the United States, not Otherwise Classified",N
0,00,20-133700,"Interest on Loans to the Helium Fund, Department of Interior",N
0,00,20-133800,Interest on Loans to the Presidio,N
0,00,20-135000,"Interest on Loans to the Secretary of Transportation, Ocean Freight Differential",N
0,00,20-135100,Interest on Loans to BPA,N
0,00,20-136300,"Interest on Loans for College Housing and Academic Facilities Loans, Education",N
0,00,20-140100,Interest on Loans to Commodity Credit Corporation,N
0,00,20-141300,"Interest on Loans to Temporary Corporate Credit Union Stabilization Fund, NCUA",N
0,00,20-141500,Interest on Loans to Federal Deposit Insurance Corporation,N
0,00,20-141800,Interest on Loans to Federal Financing Bank,N
0,00,20-142500,Interest on Loans to Rural Development Insurance Fund,N
0,00,20-143300,"Interest on Loans to National Flood Insurance Fund, DHS",N
