account-seq,bureau-code,treasury-code,account_name,account-deleted
0,00,20-143500,"General Fund Proprietary Interest Receipts, not Otherwise Classified",N
0,00,20-145000,"Interest Payments from States, Cash Management Improvement",N
0,00,20-146310,Interest on Quota in International Monetary Fund,N
0,00,20-146320,Interest on Loans to International Monetary Fund,N
0,00,20-146400,Interest Received on Loans and Credits to Foreign Nations,N
0,00,20-148400,Interest on Deposits in Tax and Loan Accounts,N
0,00,20-149500,Interest Payments on Repayable Advances to the Black Lung Disability Trust Fund,N
0,00,20-149700,Payment of Interest on Advances to the Railroad Retirement Board,N
0,00,20-149900,Interest Received from Credit Financing Accounts,N
0,00,20-150110,Interest on Loans or Advances to the Extended Unemployment Compensation Account,N
0,00,20-150120,Interest on Loans and Repayable Advances to the Federal Unemployment Account,N
0,00,20-168200,Gain by Exchange on Foreign Currency Denominated Public Debt Securities,N
0,00,20-241100,User Fees for IRS,N
0,00,20-241600,Charges for Administrative Expenses of Social Security Act As Amended,N
0,00,20-248500,GSE Fees Pursuant to P.L. 112–78 Sec. 401,N
0,00,20-249200,"Premiums, Terrorism Risk Insurance Program",N
0,00,20-261400,Proceeds from Sale of Securities from the AIG Credit Facility Trust,N
0,00,20-276330,"Community Development Financial Institutions Fund, Downward Re-estimate of Subsidies",N
0,00,20-276610,"Air Transportation Safety and System Stabilization Act, Negative Subsidies",N
0,00,20-277130,"Air Transportation Stabilization Guaranteed Loan, Downward Reestimates of Subsidies",N
0,00,20-278430,"Small Business Lending Fund Direct Loans, Downward Reestimates of  Subsidies",N
0,00,20-279010,"GSE Mortgage-Backed Securities Direct Loans, Negative Subsidies",N
0,00,20-279030,"GSE Mortgage-Backed Securities Direct Loans, Downward Reestimates of Subsidies",N
0,00,20-279110,"Government Sponsored Enterprise Credit Facility, Negative Subsidies",N
0,00,20-279210,"Troubled Asset Relief Program, Negative Subsidies",N
0,00,20-279230,"Troubled Asset Relief Program, Downward Reestimates of Subsidies",N
0,00,20-286800,Dollar Conversion of Foreign Currency Loan Repayments,N
0,00,20-289400,"Proceeds, GSE Equity Related Transactions",N
0,00,20-289500,"Proceeds, TARP Equity Related Transactions",N
0,00,20-289600,Excess of Proceeds from Debt Obligations Issued by the Black Lung Disability Trust Fund and the Market Value of Outstanding Repayable Advances,N
0,00,20-309200,Recovery from Highway Trust Fund for Refunds of Taxes,N
0,00,20-309400,Recovery from Airport and Airway Trust Fund for Refunds of Taxes,N
0,00,20-309500,"Recovery from Leaking Underground Storage Tank Trust Fund for Refunds of Taxes, EPA",N
0,00,20-309990,Refunds of Moneys Erroneously Received and Recovered (20X1807),N
0,00,20-310100,Recoveries from Federal Agencies for Settlement of Claims for Contract Disuptes,N
0,00,20-311200,Reimbursement from Federal Agencies for Payments Made As a Result of Discriminatory Conduct,N
0,00,20-322000,All Other General Fund Proprietary Receipts,N
0,00,20-387500,Budget Clearing Account (suspense),N
0,00,20-388500,Undistributed Intragovernmental Payments and Receivables from Cancelled Accounts,N
0,00,20-500530,"Land and Water Conservation Fund, Motorboat Fuels Tax",N
0,00,20-508010,Gifts to the United States for Reduction of the Public Debt,N
0,00,20-543210,"New Installment Agreements, IRS Miscellaneous Retained Fees",N
0,00,20-543230,"Restructured Installment Agreements, IRS Miscellaneous Retained Fees",N
0,00,20-543240,"Enrolled Agent Fee Increase, IRS Miscellaneous Retained Fees",N
0,00,20-543250,"General User Fees, IRS Miscellaneous Retained Fees",N
0,00,20-543260,"Tax Preparer Registration Fees, IRS Miscellaneous Retained Fees",N
0,00,20-543270,"Photopying Fees, IRS Miscellaneous Retained Fees",N
0,00,20-543310,Underpayment and Fraud Collection,N
0,00,20-544510,Debt Collection,N
0,00,20-551010,Private Collection Agent Program,N
0,00,20-559010,"Fees and Assessments, Financial Research Fund",N
0,00,20-559020,"Interest, Financial Research Fund",N
0,00,20-559030,"Transfer from the Federal Reserve, Financial Research Fund",N
0,00,20-568810,"Antidumping and Countervailing Duties, Continued Dumping and Subsidy Offset",N
0,00,20-569710,"Forfeited Cash and Proceeds from Sale of Forfeited Property, Treasury Forfeiture Fund",N
0,00,20-569720,"Earnings on Investments, Treasury Forfeiture Fund",N
0,00,20-573710,"Deposits, Internal Revenue Collections for Puerto Rico",N
0,00,73-142800,Interest on Advances to Small Business Administration,N
0,00,86-289100,"Proceeds, Grants for Emergency Mortgage Relief Derived from Emergency Homeowners' Relief Fund",N
0,00,91-142200,"Interest on Loans, Higher Education Facilities Loan Fund",N
0,00,95-085015,"Registration, Filing, and Transaction Fees, SEC",N
0,00,95-109900,"Fines, Penalties, and Forfeitures, not Otherwise Classified",N
0,00,20-820710,"General Fund Payments, Lower Brule Sioux Tribe Terrestrial Wildlife Habitat Restoration Trust Fund",N
0,00,20-820720,"Earnings on Investments, Lower Brule Sioux Tribe Terrestrial Wildlife Habitat Restoration Trust Fund",N
0,00,20-820910,"General Fund Payments, Cheyenne River Sioux Tribe Terrestrial Wildlife Habitat Restoration Trust Fund",N
0,00,20-820920,"Earnings on Investments, Cheyenne River Sioux Tribe Terrestrial Wildlife Habitat Restoration Trust Fund",N
0,00,20-852420,"Federal Payment, Capital Magnet Fund",N
0,00,20-852430,Payment from the Community Development Financial Institutions Fund,N
0,00,20-879010,"Gifts and Bequests, Office of the Secretary",N
0,00,20-977920,"Interest, Miscellaneous Trust Funds, Government-wide",N
0,05,20-0101,Salaries and Expenses,N
0,05,20-0115,Department-wide Systems and Capital Investments Programs,N
0,05,20-0106,Office of Inspector General,N
0,05,20-0119,Treasury Inspector General for Tax Administration,N
0,05,20-0108,Treasury Building and Annex Repair and Restoration,N
0,05,20-0121,Expanded Access to Financial Services,N
0,05,20-0117,Counterterrorism Fund,N
0,05,20-0123,Terrorism Insurance Program,N
0,05,20-5697,Treasury Forfeiture Fund,N
0,05,20-5590,Financial Research Fund,N
0,05,20-5081,Presidential Election Campaign Fund,N
0,05,20-5407,Sallie Mae Assessments,N
0,05,20-4444,Exchange Stabilization Fund,N
0,05,20-4501,Working Capital Fund,N
0,05,20-4560,Treasury Franchise Fund,N
0,05,20-0129,"Administrative Expenses, Recovery Act",N
0,05,20-0140,"Grants for Specified Energy Property in Lieu of Tax Credits, Recovery Act",N
0,05,20-0139,Grants to States for Low-Income Housing Projects in Lieu of Low-Income Housing Credit Allocations,N
0,05,20-1881,Community Development Financial Institutions Fund Program Account,N
0,05,20-4088,Community Development Financial Institutions Fund Direct Loan Financing Account,N
0,05,20-8526,Violent Crime Reduction Program,N
0,05,20-0128,Office of Financial Stability,N
0,05,20-0132,Troubled Asset Relief Program Account,N
0,05,20-4277,Troubled Asset Relief Program Direct Loan Financing Account,N
0,05,20-4276,Troubled Assets Insurance Financing Fund Guaranteed Loan Financing Account,N
0,05,20-0134,Troubled Asset Relief Program Equity Purchase Program,N
0,05,20-4278,Troubled Asset Relief Program Equity Purchase Financing Account,N
0,05,20-0136,"Troubled Asset Relief Program, Housing Programs",N
0,05,20-4329,"Troubled Asset Relief Program, Home Affordable Modification Program, Letter of Credit Financing Account",N
0,05,20-0133,Special Inspector General for the Troubled Asset Relief Program,N
0,05,20-0141,Small Business Lending Fund Program Account,N
0,05,20-4349,Small Business Lending Fund Financing Account,N
0,05,20-0142,State Small Business Credit Initiative,N
0,05,20-0125,GSE Preferred Stock Purchase Agreements,N
0,05,20-0126,GSE Mortgage-Backed Securities Purchase Program Account,N
0,05,20-4272,GSE Mortgage-Backed Securities Purchase Direct Loan Financing Account,N
0,05,20-4298,State HFA Direct Loan Financing Account,N
0,05,20-4273,Government Sponsored Enterprise Credit Facility Direct Loan Financing Account,N
0,05,20-8524,"Capital Magnet Fund, Community Develpment Financial Institutions",N
0,05,20-8790,Gifts and Bequests,N
0,04,20-0173,Salaries and Expenses,N
0,09,20-1501,Interagency Crime and Drug Enforcement,N
0,12,20-0520,"Salaries and Expenses, Fiscal Service",N
0,12,20-0177,"Payment to Justice, FIRREA Related Claims",N
0,12,20-0562,Reimbursements to Federal Reserve Banks,N
0,12,20-0504,"Restoration of Lost Interest, Medicare Trust Funds",N
0,12,20-1851,Payment to the Resolution Funding Corporation,N
0,12,20-5582,Hope Bond Payment Fund,N
0,12,20-1805,Payment to the Cheyenne River Sioux Tribal Recovery Trust Fund,N
0,12,20-5535,Federal Reserve Bank Reimbursement,N
0,12,20-0510,Gifts to the United States for Reduction of the Public Debt,N
0,12,20-1884,Federal Reserve Bank Reimbursement Fund,N
0,12,20-1710,Payment of Government Losses in Shipment,N
0,12,20-1802,Financial Agent Services,N
0,12,20-1803,Temporary State Fiscal Assistance Fund,N
0,12,,Payment to terrestrial wildlife habitat restoration trust fund,N
0,12,20-1860,Interest on Uninvested Funds,N
0,12,20-1877,Federal Interest Liabilities to States,N
0,12,20-1880,Interest Paid to Credit Financing Accounts,N
0,12,20-1895,"Claims, Judgments, and Relief Acts",N
0,12,20-1875,Restitution of Forgone Interest,N
0,12,20-1825,Payment to FRA for AMTRAK Debt Restructuring,N
0,12,20-0114,Biomass Energy Development,N
0,12,20-5816,Confiscated and Vested Iraqi Property and Assets,N
0,12,20-5688,Continued Dumping and Subsidy Offset,N
0,12,20-4109,Check Forgery Insurance Fund,N
0,12,20-8209,Cheyenne River Sioux Tribe Terrestrial Wildlife Habitat Restoration Trust Fund,N
0,11,20-4521,Federal Financing Bank,N
0,13,20-1008,Salaries and Expenses,N
0,13,20-5737,Internal Revenue Collections for Puerto Rico,N
0,20,20-4502,Bureau of Engraving and Printing Fund,N
0,25,20-4159,United States Mint Public Enterprise Fund,N
0,45,20-0912,Taxpayer Services,N
0,45,20-0913,Enforcement,N
0,45,20-0928,Health Insurance Tax Credit Administration,N
0,45,20-0919,Operations Support,N
0,45,20-0921,Business Systems Modernization,N
0,45,20-0935,"Build America Bond Payments, Recovery Act",N
0,45,20-0906,Payment Where Earned Income Credit Exceeds Liability for Tax,N
0,45,20-0922,Payment Where Child Tax Credit Exceeds Liability for Tax,N
0,45,20-0923,Payment Where Health Coverage Tax Credit Exceeds Liability for Tax,N
0,45,20-0936,Payment Where COBRA Credit Exceeds Liability for Tax,N
0,45,20-0951,Payment Where Small Business Health Insurance Tax Credit Exceeds Liability for Tax,N
0,45,20-0929,Payment Where Alternative Minimum Tax Credit Exceeds Liability for Tax,N
0,45,20-0930,Payment Where Tax Credit to Aid First-Time Homebuyers Exceeds Liability for Tax,N
0,45,20-0931,Payment Where Certain Tax Credits Exceed Liability for Corporate Tax,N
0,45,20-0942,Payment Where Tax Credit for Certain Government Retirees Exceeds Liability for Tax,N
0,45,20-0948,Payment to Issuer of Qualified Energy Conservation Bonds,N
0,45,20-0947,Payment to Issuer of New Clean Renewable Energy Bonds,N
0,45,20-0946,Payment to Issuer of Qualified School Construction Bonds,N
0,45,20-0945,Payment to Issuer of Qualified Zone Academy Bonds,N
0,45,20-0950,Payment Where Adoption Credit Exceeds Liability for Tax,N
0,45,20-0952,Therapeutic Discovery Program Grants and Administration,N
0,45,20-0904,"Refunding Internal Revenue Collections, Interest",N
0,45,20-0949,Refundable Premium Assistance Tax Credit,N
0,45,20-5432,IRS Miscellaneous Retained Fees,N
0,45,20-5080,Gifts to the United States for Reduction of the Public Debt,N
0,45,20-5510,Private Collection Agent Program,N
0,45,20-5433,Informant Payments,N
0,45,20-4413,Federal Tax Lien Revolving Fund,N
0,45,,Internal Revenue Service Oversight Board,N
0,45,,ADMINISTRATIVE PROVISIONS—INTERNAL REVENUE SERVICE,N
0,57,20-4264,"Public Enterprise Fund, Comptroller of the Currency",N
0,57,20-8413,Assessment Funds,N
0,58,20-4108,Office of Thrift Supervision,N
0,60,20-0555,Interest Paid to Trust Fund Receipt Accounts - Shadow Account,N
0,60,20-0556,Interest Paid to Expenditure Accounts - Shadow Account,N
0,60,20-0557,Interest Paid to Federal Fund Receipt Accounts - Shadow Account,N
0,60,20-0550,Interest on Treasury Debt Securities (gross),N
0,SP,,GENERAL FUND RECEIPT ACCOUNTS,N
0,SP,,ADMINISTRATIVE PROVISIONS—DEPARTMENT OF THE TREASURY,N
0,SP,,TITLE VI—GENERAL PROVISIONS—THIS ACT,N
0,00,20-015800,Transportation Fuels Tax,N
0,00,20-508110,Presidential Election Campaign Fund,N
0,00,99-011050,Individual Income Taxes,N
0,00,99-011100,Corporation Income and Excess Profits Taxes,N
0,00,99-015250,Other Federal Fund Excise Taxes,N
0,00,99-015300,Estate and Gift Taxes,N
0,00,99-015500,Tobacco Excise Tax,N
0,00,99-015600,Alcohol Excise Tax,N
0,00,99-015700,Telephone Excise Tax,N
0,00,99-015911,Excise Tax on High Cost Employer-Sponsored Plans,N
0,00,99-015912,Taxes on Failures by Hospitals,N
0,00,99-015913,Fee on Health Insurance Providers,N
0,00,99-015914,Tax on Indoor Tanning Services,N
0,00,99-015915,Excise Tax on Medical Device Manufacturers,N
0,00,99-031050,Other Federal Fund Customs Duties,N
0,00,99-089400,Ozone Depleting Chemicals Tax,N
0,00,99-705000,Net Cap and Trade Auction Receipts,N
0,00,36-143500,"General Fund Proprietary Interest Receipts, not Otherwise Classified",N
0,00,36-246800,"Pharmaceutical Copayments, Increase from PL 7/8",N
0,00,36-247300,"Contributions from Military Personnel, Veteran's Educational Assistance Act of 1984",N
0,00,36-247600,Enrollment Fee for PL 7/8,N
0,00,36-247700,Eliminate Third Party Offset,N
0,00,36-273330,Housing Downward Reestimates,N
0,00,36-275110,"Native American Veteran Housing Loans, Negative Subsidies",N
0,00,36-275130,"Native American Direct Loans, Downward Reestimate of Subsidies",N
0,00,36-275510,Housing Negative Subsidies,N
0,00,36-322000,All Other General Fund Proprietary Receipts Including Budget Clearing Accounts,N
0,00,36-388500,Undistributed Intragovernmental Payments and Receivables from Cancelled Accounts,N
0,00,36-528710,"Pharmaceutical Co-payments, MCCF",N
0,00,36-528711,"Medical Care Collections Fund, Third Party Prescription Claims",N
0,00,36-528712,"Enhanced-use Lease Proceeds, MCCF",N
0,00,36-528713,Fee Basis 3rd Party MCCF,N
0,00,36-528730,"First Party Collections, MCCF",N
0,00,36-528740,"Third Party Collections, MCCF",N
0,00,36-528750,"MCCF, Asset Sales",N
0,00,36-528760,"Parking Fees, MCCF",N
0,00,36-528770,"Compensated Work Therapy, MCCF",N
0,00,36-528780,"Payments from Compensation and Pension, MCCF",N
0,00,36-528790,"MCCF, Long-term Care Copayments",N
0,00,36-535830,"Enhanced-use Lease Proceeds, Veterans Health Services Improvement Fund",N
0,00,36-537310,"Enrollment Fee, MCCF",N
0,00,36-813210,"NSLI Fund, Premium and Other Receipts",N
0,00,36-813220,"NSLI Fund, Interest",N
0,00,36-813310,"Deductions from Military Pay, Post-Vietnam Era Veterans Education Account",N
0,00,36-813320,"Contributions, Post-Vietnam Era Veterans Education Account",N
0,00,36-815020,"Interest and Profits on Investments in Public Debt Securities, USGLI",N
0,00,36-818010,"General Post Fund, National Homes, Deposits",N
0,00,36-818020,"General Post Fund, National Homes, Interest on Investments",N
0,15,36-0160,Medical Services,N
0,15,36-0152,Medical Support and Compliance,N
0,15,36-0165,DOD-VA Health Care Sharing Incentive Fund,N
0,15,36-0162,Medical Facilities,N
0,15,36-0161,Medical and Prosthetic Research,N
0,15,36-0169,Joint Department of Defense-Department of Veterans Affairs Medical Facility Demonstration Fund,N
0,15,36-5287,Medical Care Collections Fund,N
0,15,36-4014,Canteen Service Revolving Fund,N
0,15,36-4026,Medical Center Research Organizations,N
0,15,36-8180,"General Post Fund, National Homes",N
0,25,36-0102,Compensation and Pensions,N
0,25,36-0137,Readjustment Benefits,N
0,25,36-0120,Veterans Insurance and Indemnities,N
0,25,36-1121,Filipino Veterans Equity Compensation Fund,N
0,25,36-4012,Service-disabled Veterans Insurance Fund,N
0,25,36-4010,Veterans Reopened Insurance Fund,N
0,25,36-4009,Servicemembers' Group Life Insurance Fund,N
0,25,36-1119,Veterans Housing Benefit Program Fund,N
0,25,36-4127,Housing Direct Loan Financing Account,N
0,25,36-4129,Housing Guaranteed Loan Financing Account,N
0,25,36-4025,Housing Liquidating Account,N
0,25,36-1120,Native American Veteran Housing Loan Program Account,N
0,25,36-4130,Native American Direct Loan Financing Account,N
0,25,36-4258,Transitional Housing Direct Loan Financing Account,N
0,25,36-4112,Vocational Rehabilitation Direct Loan Financing Account,N
0,25,36-8133,Post-Vietnam Era Veterans Education Account,N
0,25,36-8132,National Service Life Insurance Fund,N
0,25,36-8150,United States Government Life Insurance Fund,N
0,25,36-8455,Veterans Special Life Insurance Fund,N
0,40,36-0110,"Construction, Major Projects",N
0,40,36-0111,"Construction, Minor Projects",N
0,40,36-0181,Grants for Construction of State Extended Care Facilities,N
0,40,36-0183,Grants for Construction of Veterans Cemeteries,N
0,40,36-0142,General Administration,N
0,40,36-0170,Office of Inspector General,N
0,40,36-0167,Information Technology Systems,N
0,40,36-0129,National Cemetery Administration,N
0,40,36-4537,Supply Fund,N
0,40,36-4539,Franchise Fund,N
0,40,,ADMINISTRATIVE PROVISIONS,N
0,SP,,GENERAL FUND RECEIPT ACCOUNTS,N
0,SP,,TITLE V—GENERAL PROVISIONS,N
0,00,96-143500,"General Fund Proprietary Interest Receipts, not Otherwise Classified",N
0,00,96-322000,All Other General Fund Proprietary Receipts Including Budget Clearing Accounts,N
0,00,96-388500,Undistributed Intragovernmental Payments and Receivables from Cancelled Accounts,N
0,00,96-500700,"Special Recreation Use Fees, Corps of Engineers",N
0,00,96-509000,"Receipts from Leases of Lands Acquired for Flood Control, Navigation, and Allied Purposes",N
0,00,96-512500,"Licenses under Federal Power Act, Improvements of Navigable Waters, Maintenance and Operation of Dams, Etc.",N
0,00,96-549310,"User Fees, Fund for Non-Federal Use of Disposal Facilities",N
0,00,96-3132,Office of the Assistant Secretary of the Army for Civil Works,N
0,00,96-3122,Construction,N
0,00,96-3123,Operation and Maintenance,N
0,00,96-5383,Special Recreation User Fee,N
0,00,96-3112,Mississippi River and Tributaries,N
0,00,96-3125,Flood Control and Coastal Emergencies,N
0,00,96-3121,Investigations,N
0,00,96-3126,Regulatory Program,N
0,00,96-3130,Formerly Utilized Sites Remedial Action Program,N
0,00,96-3124,Expenses,N
0,00,96-3128,Washington Aqueduct,N
0,00,96-9921,Permanent Appropriations,N
0,00,96-4902,Revolving Fund,N
0,00,20-886130,"Users Fees, Inland Waterways Trust Fund",N
0,00,96-821720,"Earnings on Investments, South Dakota Terrestrial Wildlife Habitat Restoration Trust Fund",N
0,00,96-886110,"Transfer from General Fund, Inland Waterways Revenue Act Taxes",N
0,00,96-886120,"Interest and Profits on Investments in Public Debt Securities, Inland Waterways Trust Fund",N
0,00,96-886210,"Contributions, Rivers and Harbors, Other Than Port and Harbor User Fees",N
0,00,96-886310,"User Fees, Harbor Maintenance Trust Fund",N
0,00,96-886320,"Earnings on Investments, Harbor Maintenance Trust Fund",N
0,00,96-8863,Harbor Maintenance Trust Fund,N
0,00,96-8861,Inland Waterways Trust Fund,N
0,00,96-8862,Rivers and Harbors Contributed Funds,N
0,00,96-8333,Coastal Wetlands Restoration Trust Fund,N
0,00,96-8217,South Dakota Terrestrial Wildlife Habitat Restoration Trust Fund,N
0,SP,,GENERAL FUND RECEIPT ACCOUNTS,N
0,SP,,Allocations Received from Other Accounts,N
0,SP,,ADMINISTRATIVE PROVISIONS,N
0,SP,,GENERAL PROVISIONS—CORPS OF ENGINEERS—CIVIL,N
0,SP,,TITLE III—GENERAL PROVISION,N
0,05,97-0040,Payment to Military Retirement Fund,N
0,05,97-809710,"Employing Agency Contributions, Military Retirement Fund",N
0,05,97-809720,"Earnings on Investments, Military Retirement Fund",N
0,05,97-809730,"Federal Contributions, Military Retirement Fund",N
0,05,97-809740,"Federal Contributions (concurrent Receipt Accruals), Military Retirement Fund",N
0,05,97-8097,Military Retirement Fund,N
0,07,97-547210,"Non-DoD Employing Agency Contributions, DoD Medicare-Eligible Retiree Health Care Fund",N
0,07,97-547220,"Earnings on Investments, DoD Medicare-Eligible Retiree Health Care Fund",N
0,07,97-547230,"Federal Contributions, DoD Medicare-Eligible Retiree Health Care Fund",N
0,07,97-547250,"Department of Defense Contributions, DoD Medicare-Eligible Retiree Health Care Fund",N
0,07,97-0850,Payment to Department of Defense Medicare-Eligible Retiree Health Care Fund,N
0,07,97-5472,Department of Defense Medicare-Eligible Retiree Health Care Fund,N
0,10,97-809810,"Employing Agency Contributions, Education Benefits Fund",N
0,10,97-809820,"Interest on Investments, Education Benefits Fund",N
0,10,97-8098,Education Benefits Fund,N
0,15,74-0100,Salaries and Expenses,N
0,15,74-0101,Foreign Currency Fluctuations Account,N
0,15,74-856910,"Contributions, American Battle Monuments Commission",N
0,15,74-856920,"Earnings on Investments, American Battle Monuments Commission",N
0,15,74-8569,Contributions,N
0,20,84-0100,"General Fund Payment, Armed Forces Retirement Home",N
0,20,84-852230,"Fines and Forfeitures, Armed Forces Retirement Home",N
0,20,84-852240,"Other Receipts, Armed Forces Retirement Home",N
0,20,84-852250,"Gifts, Armed Forces Retirement Home",N
0,20,84-852260,"Property Sales/Leases, Armed Forces Retirement Home",N
0,20,84-852280,General Fund Payment to the Armed Forces Retirement Home,N
0,20,97-852210,"Deductions, Armed Forces Retirement Home",N
0,20,97-852220,"Interest from Investments, Armed Forces Retirement Home",N
0,20,84-8522,Armed Forces Retirement Home,N
0,25,21-1805,Salaries and Expenses,N
0,30,97-509500,"Sales of Hunting and Fishing Permits, Military Reservations",N
0,30,97-5095,Wildlife Conservation,N
0,45,90-0400,Salaries and Expenses,N
0,SP,,GENERAL FUND RECEIPT ACCOUNTS,N
0,00,20-529500,Environmental Services,N
0,00,68-089300,"User Fees, Hazardous Waste Electronic Manifest",N
0,00,68-089500,"Registration, PMN, Other Services",N
0,00,68-143500,"General Fund Proprietary Interest Receipts, not Otherwise Classified",N
0,00,68-275330,"Downward Reestimates of Subsidies, Abatement, Control and Compliance Loans",N
0,00,68-322000,All Other General Fund Proprietary Receipts Including Budget Clearing Accounts,N
0,00,68-322900,"Cellulosic Biofuel Waiver Credits, Renewal Fuel Program",N
0,00,68-323100,Special and Trust Fund Gov Receipts Returned to the General Fund,N
0,00,68-388500,Undistributed Intragovernmental Payments and Receivables from Cancelled Accounts,N
0,00,68-537410,"Registration Service Fees, Pesticide Registration Fund",N
0,00,68-537420,"Interest on Investments, Pesticide Registration Fund",N
0,00,68-552410,"User Fees, Registration Review",N
0,00,68-552610,"User Fees, Pesticide Tolerance",N
0,00,68-552710,"User Fees, Pre-manufacture Notice",N
0,00,68-0200,Program and Research Operations,N
0,00,68-0112,Office of Inspector General,N
0,00,68-0107,Science and Technology,N
0,00,68-0108,Environmental Programs and Management,N
0,00,68-0110,Buildings and Facilities,N
0,00,68-0103,State and Tribal Assistance Grants,N
0,00,68-0250,Payment to the Hazardous Substance Superfund,N
0,00,68-5295,Environmental Services,N
0,00,68-5374,Pesticide Registration Fund,N
0,00,68-4310,Reregistration and Expedited Processing Revolving Fund,N
0,00,68-4565,Working Capital Fund,N
0,00,68-4322,"Abatement, Control, and Compliance Direct Loan Financing Account",N
0,00,20-814516,"Payment from the General Fund, Hazardous Substance Superfund, Recovery Act",N
0,00,20-815340,"Payment from the General Fund, Leaking Underground Storage Tank Trust Fund",N
0,00,68-814510,"Excise Taxes, Hazardous Substance Superfund",N
0,00,68-814515,"Corporation Income Taxes, Hazardous Substance Superfund",N
0,00,68-814520,"Interest and Profits on Investments, Hazardous Substance Superfund",N
0,00,68-814530,"Fines and Penalties, and Miscellaneous, Hazardous Substance Superfund",N
0,00,68-814540,"Recoveries, Hazardous Substance Superfund",N
0,00,68-814550,"Interfund Transactions, Hazardous Substance Superfund",N
0,00,68-815310,"Transfer from the General Fund Amounts Equivalent to Taxes, Leaking Underground Storage Tank Trust Fund",N
0,00,68-815320,"Earnings on Investments, Leaking Underground Storage Tank Trust Fund",N
0,00,68-815330,"Recoveries, Leaking Underground Storage Tank Trust Fund",N
0,00,68-8145,Hazardous Substance Superfund,N
0,00,68-8153,Leaking Underground Storage Tank Trust Fund,N
0,00,68-8221,Inland Oil Spill Programs,N
0,00,,ADMINISTRATIVE PROVISIONS,N
0,SP,,GENERAL FUND RECEIPT ACCOUNTS,N
0,00,11-322000,All Other General Fund Proprietary Receipts Including Budget Clearing Accounts,N
0,00,11-388517,Undistributed Intragovernmental Payments and Receivables from Cancelled Accounts,N
0,00,11-551210,Spectrum Relocation Receipts,N
0,00,,Privacy and Civil Liberties Oversight Board,N
0,05,11-0209,The White House,N
0,05,11-1073,Armstrong Resolution Account,N
0,10,11-0210,Operating Expenses,N
0,10,11-0109,White House Repair and Restoration,N
0,15,11-1454,Special Assistance to the President and the Official Residence of the Vice President,N
0,20,11-1900,Salaries and Expenses,N
0,25,11-1453,Council on Environmental Quality and Office of Environmental Quality,N
0,25,11-3963,"Management Fund, Office of Environmental Quality",N
0,35,11-2000,Salaries and Expenses,N
0,50,11-0038,Salaries and Expenses,N
0,55,11-0300,Office of Management and Budget,N
0,60,11-1457,Office of National Drug Control Policy,N
