account-seq,bureau-code,treasury-code,account_name,account-deleted
0,00,,EXPLANATION OF ESTIMATES,N
0,SP,,GENERAL PROVISIONS,N
0,05,00-0100,"Compensation of Members, Senate",N
0,05,,Expense Allowances,N
0,05,,Representation Allowances for the Majority and Minority Leaders,N
0,05,,"Salaries, Officers and Employees",N
0,05,,Office of the Legislative Counsel of the Senate,N
0,05,00-0110,"Salaries, Officers and Employees",N
0,05,,Office of Senate Legal Counsel,N
0,05,,Payments to widows and heirs of deceased members of Congress,N
0,05,,"Expense Allowances of the Secretary of the Senate, Sergeant at Arms and Doorkeeper of the Senate, and Secretaries for the Majority and Minority of the Senate",N
0,05,00-0185,Office of the Legislative Counsel of the Senate,N
0,05,,Contingent Expenses of the Senate,N
0,05,,Expenses of the United States Senate Caucus on International Narcotics Control,N
0,05,,Secretary of the Senate,N
0,05,,Sergeant at Arms and Doorkeeper of the Senate,N
0,05,,Miscellaneous Items,N
0,05,00-0128,Inquiries and Investigations,N
0,05,,Senators' Official Personnel and Office Expense Account,N
0,05,,Official Mail Costs,N
0,05,00-0123,Miscellaneous Items,N
0,05,00-0130,Senators' Official Personnel and Office Expense Account,N
0,05,00-0126,Secretary of the Senate,N
0,05,00-0127,Sergeant at Arms and Doorkeeper of the Senate,N
0,05,00-0188,"Congressional Use of Foreign Currency, Senate",N
0,05,00-9911,Senate Items,N
0,05,00-9932,Senate Revolving Funds,N
0,05,,ADMINISTRATIVE PROVISIONS,N
0,10,00-0200,Compensation of Members and Related Administrative Expenses,N
0,10,,Salaries and Expenses,N
0,10,00-9931,House Revolving Funds,N
0,10,00-0400,Salaries and Expenses,N
0,10,00-0488,"Congressional Use of Foreign Currency, House of Representatives",N
0,10,,ADMINISTRATIVE PROVISIONS,N
0,11,00-322000,All Other General Fund Proprietary Receipts Including Budget Clearing Accounts,N
0,11,00-0181,Joint Economic Committee,N
0,11,00-0460,Joint Committee on Taxation,N
0,11,00-0186,Joint Congressional Committee on Inaugural Ceremonies of 2013,N
0,11,,Joint Committee on Taxation,N
0,11,00-0425,Office of the Attending Physician,N
0,11,,Office of the Attending Physician,N
0,11,00-0190,Office of Congressional Accessibility Services,N
0,11,,Office of Congressional Accessibility Services,N
0,11,,ADMINISTRATIVE PROVISIONS,N
0,13,02-0477,Salaries,N
0,13,02-0476,General Expenses,N
0,13,02-0461,Security Enhancements,N
0,13,,ADMINISTRATIVE PROVISIONS,N
0,12,09-1600,Salaries and Expenses,N
0,12,09-1450,Awards and Settlements Funds,N
0,14,08-0100,Salaries and Expenses,N
0,14,,ADMINISTRATIVE PROVISIONS,N
0,15,01-322000,All Other General Fund Proprietary Receipts Including Budget Clearing Accounts,N
0,15,01-0100,General Administration,N
0,15,01-0105,Capitol Building,N
0,15,01-0108,Capitol Grounds,N
0,15,01-0123,Senate Office Buildings,N
0,15,01-0127,House Office Buildings,N
0,15,01-1833,House Historic Buildings Revitalization Trust Fund,N
0,15,01-0133,Capitol Power Plant,N
0,15,01-0155,Library Buildings and Grounds,N
0,15,01-0171,Capitol Police Buildings and Grounds,N
0,15,01-0161,Capitol Visitor Center,N
0,15,01-4296,Capitol Visitor Center Revolving Fund,N
0,15,01-4518,Judiciary Office Building Development and Operations Fund,N
0,15,01-818910,Gifts and Donations,N
0,15,01-8189,Gifts and Donations,N
0,18,09-0200,Botanic Garden,N
0,18,09-8292,Gifts and Donations,N
0,18,,ADMINISTRATIVE PROVISIONS,N
0,25,03-322000,All Other General Fund Proprietary Receipts Including Budget Clearing Accounts,N
0,25,03-388500,Undistributed Intragovernmental Payments,N
0,25,03-517510,"Fees from Jukebox, Satellite and Cable Television for Operating Costs, Copyright Office",N
0,25,03-517520,"Interest on Investments in Public Debt Securities, Copyright Office",N
0,25,03-517530,"Fees for Digital Audio Recording Technology, Operating Costs",N
0,25,03-0101,"Salaries and Expenses, Library of Congress",N
0,25,03-0102,Copyright Office: Salaries and Expenses,N
0,25,03-0127,Congressional Research Service: Salaries and Expenses,N
0,25,03-0141,Books for the Blind and Physically Handicapped: Salaries and Expenses,N
0,25,03-0146,Furniture and Furnishings,N
0,25,03-5175,Payments to Copyright Owners,N
0,25,03-4325,Cooperative Acquisitions Program Revolving Fund,N
0,25,03-4339,Duplication Services,N
0,25,03-4346,"Gift Shop, Decimal Classification, Photo Duplication, and Related Services",N
0,25,03-4543,Fedlink Program and Federal Research Program,N
0,25,03-803110,"Contributions, Library of Congress Gift Fund",N
0,25,03-803210,"Contributions, Library of Congress Permanent Loan Account",N
0,25,03-803220,"Interest, Library of Congress Permanent Loan Account",N
0,25,03-803221,"Income from Donated Securities, Library of Congress",N
0,25,03-820810,"Deposits, Service Fees, Library of Congress",N
0,25,03-9971,Gift and Trust Fund Accounts,N
0,25,,ADMINISTRATIVE PROVISIONS,N
0,30,04-0203,Congressional Printing and Binding,N
0,30,04-0201,Office of Superintendent of Documents: Salaries and Expenses,N
0,30,04-4505,Government Printing Office Revolving Fund,N
0,35,05-0107,Salaries and Expenses,N
0,35,,ADMINISTRATIVE PROVISIONS,N
0,40,23-0100,Salaries and Expenses,N
0,40,23-811520,"Tax Court Judges Survivors Annuity, Interest and Profits on Investments",N
0,40,23-8115,Tax Court Judges Survivors Annuity Fund,N
0,45,00-550910,"Gifts, Senate Preservation Fund",N
0,45,00-550920,"Earnings on Investments, Senate Preservation Fund",N
0,45,48-554910,"Gifts and Contributions, Dwight D. Eisenhower Memorial Fund",N
0,45,48-554920,"Earnings on Investments, Dwight D. Eisenhower Memorial Fund",N
0,45,48-1550,Medicare Payment Advisory Commission,N
0,45,09-1801,Medicaid and Chip Payment and Access Commission,N
0,45,48-2973,United States-China Economic and Security Review Commission,N
0,45,48-2975,Commission on International Religious Freedom,N
0,45,09-1501,National Commission on Terrorist Attacks upon the United States,N
0,45,09-9911,Other Legislative Branch Boards and Commissions,N
0,45,48-2990,"Capital Construction, Dwight D. Eisenhower Memorial  Commission",N
0,45,48-5549,Dwight D. Eisenhower Memorial Fund,N
0,45,09-0145,Payment to Open World Leadership Center Trust Fund,N
0,45,48-2999,Commission on Review of Overseas Military Facility Structure of the United States,N
0,45,09-814810,"Gifts and Donations, Open World Leadership Center Trust Fund",N
0,45,09-814820,"Earnings on Investments, Open World Leadership Center Trust Fund",N
0,45,09-814830,"Payment from the General Fund, Open World Leadership Center Trust Fund",N
0,45,09-827510,"Payments, John C. Stennis Center for Public Service Training and Development",N
0,45,09-827520,"Interest Received by Trust Fund, J. C. Stennis Center",N
0,45,09-830010,"Coin Sale Surcharges, U.S. Capitol Preservation Commission",N
0,45,09-830020,"Interest on Investments, U.S. Capitol Preservation Commission",N
0,45,09-8275,John C. Stennis Center for Public Service Training and Development Trust Fund,N
0,45,09-8300,U.S. Capitol Preservation Commission,N
0,45,09-8148,Open World Leadership Center Trust Fund,N
0,SP,,GENERAL FUND RECEIPT ACCOUNTS,N
0,SP,,GENERAL PROVISIONS,N
0,00,10-510010,"Filing Fees, U.S. Courts, Judiciary",N
0,00,10-510110,"Fees, Registry Administration, Judiciary",N
0,00,10-511410,"Proceeds from Sale of Property, Judiciary Information Technology Fund",N
0,00,10-511430,"Advances and Reimbursements, Judiciary Information Technology Fund",N
0,00,10-811010,"Judicial Survivors Annuity, Deductions from Employees Salaries",N
0,00,10-811020,"Judicial Survivors Annuity, Interest and Profits on Investments",N
0,00,10-811040,Federal Payment to Judicial Survivors Annuities Fund,N
0,00,10-812210,"Deductions from Employee Salaries and Voluntary Contributions, Judicial Officers' Annuity",N
0,00,10-812220,"Interest and Profits on Investments, Judicial Officers' Annuity",N
0,00,10-812240,Federal Payment to Judicial Officers Retirement Fund,N
0,00,10-812410,Federal Payment to Claims Court Judges' Retirement Fund,N
0,00,10-812420,"Interest, Claims Court Judges' Retirement Fund",N
0,05,10-0100,Salaries and Expenses,N
0,05,10-0103,Care of the Building and Grounds,N
0,07,10-0510,Salaries and Expenses,N
0,15,10-0400,Salaries and Expenses,N
0,25,10-322000,All Other General Fund Proprietary Receipts Including Budget Clearing Accounts,N
0,25,10-0920,Salaries and Expenses,N
0,25,10-0923,Defender Services,N
0,25,10-0925,Fees of Jurors and Commissioners,N
0,25,10-0930,Court Security,N
0,25,10-5100,Judiciary Filing Fees,N
0,25,10-5101,Registry Administration,N
0,25,10-5114,Judiciary Information Technology Fund,N
0,26,10-0927,Salaries and Expenses,N
0,30,10-0928,Salaries and Expenses,N
0,35,10-0941,Payment to Judiciary Trust Funds,N
0,35,10-8122,Judicial Officers' Retirement Fund,N
0,35,10-8110,Judicial Survivors' Annuities Fund,N
0,35,10-8124,United States Court of Federal Claims Judges' Retirement Fund,N
0,39,10-0938,Salaries and Expenses,N
0,39,,ADMINISTRATIVE PROVISIONS,N
0,SP,,GENERAL FUND RECEIPT ACCOUNTS,N
0,00,12-143500,"General Fund Proprietary Interest Receipts, not Otherwise Classified",N
0,00,12-181100,National Grasslands,N
0,00,12-222100,National Forest Fund,N
0,00,12-270110,"Agriculture Credit Insurance, Negative Subsidies",N
0,00,12-270130,"Agriculture Credit Insurance, Downward Reestimates of Subsidies",N
0,00,12-270210,"Rural Electrification and Telephone Loans, Negative Subsidies",N
0,00,12-270230,"Rural Electrification and Telephone Loans, Downward Reestimates of Subsidies",N
0,00,12-270310,"Rural Water and Waste Disposal, Negative Subsidies",N
0,00,12-270330,"Rural Water and Waste Disposal, Downward Reestimates of Subsidies",N
0,00,12-270510,"Rural Community Facility, Negative Subsidies",N
0,00,12-270530,"Rural Community Facility, Downward Reestimates of Subsidies",N
0,00,12-270610,"Rural Housing Insurance, Negative Subsidies",N
0,00,12-270630,"Rural Housing Insurance, Downward Reestimates of Subsidies",N
0,00,12-270710,"Rural Business and Industry, Negative Subsidies",N
0,00,12-270730,"Rural Business and Industry, Downward Reestimates of Subsidies",N
0,00,12-270830,"P.L. 480 Loan Program, Downward Reestimates of Subsidies",N
0,00,12-271030,"Rural Development Loans, Downward Reestimates of Subsidies",N
0,00,12-271130,"Rural Telephone Bank Loans, Downward Reestimates of Subsidies",N
0,00,12-271330,"Economic Development Loans, Downward Reestimates of Subsidies",N
0,00,12-271430,"Agricultural Resource Conservation, Downward Reestimates of Subsidies",N
0,00,12-274630,"Downward Reestimates, Distance Learning, Telemedicine, and Broadband Program",N
0,00,12-275430,"Apple Loan Program, Downward Reestimates of Subsidies",N
0,00,12-275610,"Negative Subsidies, Farm Storage Facility Loans",N
0,00,12-275630,"Farm Storage Facility Loans, Downward Reestimate of Subsidies",N
0,00,12-275730,"Commodity Credit Corporation Export Guarantee Financing, Downward Reestimate of Subsidies",N
0,00,12-277930,"Multifamily Housing Revitalization Fund, Downward Reestimates of Subsidies",N
0,00,12-278630,"Rural Energy for America Program, Downward Reestimates of Subsidies",N
0,00,12-279310,"Commodity Credit Corporation Export Guarantee Financing, Negative Subsidies",N
0,00,12-322000,All Other General Fund Proprietary Receipts Including Budget Clearing Accounts,N
0,00,12-388500,Undistributed Intragovernmental Payments and Receivables from Cancelled Accounts,N
0,00,12-500810,National Forests Fund,N
0,00,12-507010,"License Fees and Defaults, Perishable Agricultural Commodities Act Fund",N
0,00,12-507020,"Earnings on Investments, Perishable Agricultural Commodities Act Fund",N
0,00,12-516110,"1990 Food, Agricultural Quarantine Inspection Fees",N
0,00,12-520110,"National Forests Fund, Payments to States",N
0,00,12-520210,"Timber Roads, Purchaser Elections",N
0,00,12-520310,"National Forests Fund, Roads and Trails for States",N
0,00,12-520410,Timber Salvage Sales,N
0,00,12-520520,"Earnings on Investments, Native American Institutions Endowment Fund",N
0,00,12-520610,"Deposits, Brush Disposal",N
0,00,12-520700,"Receipts, Cooperative Range Improvements",N
0,00,12-520810,"Deposits, Acquisitions of Lands for National Forests, Special Acts",N
0,00,12-520910,"30 Percent of Customs Duties, Funds for Strengthening Markets, Income and Supply (section 32)",N
0,00,12-520930,"General Fund Payment, Funds for Strengthening Markets, Income, and Supply (section 32)",N
0,00,12-521300,"National Forests Fund, Payments to Minnesota (Cook, Lake, and St. Louis Counties)",N
0,00,12-521610,"Land Acquisition Proceeds for Exchanges, Acquisition of Lands to Complete Land Exchanges",N
0,00,12-521640,"Facility Realignment and Enhancement Receipts, Acquisition of Lands to Complete Land Exchanges",N
0,00,12-521910,"Rents and Charges for Quarters, Forest Service",N
0,00,12-522100,"Proceeds of Land Sales, ARS",N
0,00,12-526410,Timber Sales Pipeline Restoration Fund,N
0,00,12-526810,"Recreational Fee Demonstration Program, Forest Service",N
0,00,12-527710,Midewin National Tallgrass Prairie Rental Fees,N
0,00,12-535200,"Proceeds of Land Sales, Forest Service",N
0,00,12-536010,"Charges, User Fees, and Natural Resource Utilization, Land between the Lakes, Forest Service",N
0,00,12-536110,Administration of Rights-of-way and Other Land Uses,N
0,00,12-536310,"Miscellaneous Collections, Valles Caldera Fund",N
0,00,12-551610,"Fees, Food Safety Inspection User Fee Account",N
0,00,12-551710,"Fees, Grain Inspection, Packers and Stockyards User Fee Account",N
0,00,12-551810,"Fees, Animal and Plant Health Inspection User Fee Account",N
0,00,12-553110,"3.08 Percent of Customs Duties, Agricultural Disaster Relief Fund",N
0,00,12-553120,"Earnings on Investments, Agricultural Disaster Relief Fund",N
0,00,12-554010,"Funds Retained, Stewardship Contracting Product Sales",N
0,00,12-556310,Contributions to Conservation Programs,N
0,00,12-565810,NRCS Fees for Conservation Planning,N
0,00,12-589610,National Grasslands,N
0,00,12-972210,"Miscellaneous Special Funds, Forest Service",N
0,00,12-801510,"Deposits of Fees, Inspection and Grading of Farm Products, AMS",N
0,00,12-801520,"Interest on Investments in Public Debt Securities, AMS",N
0,00,12-802810,Forest Service Cooperative Fund,N
0,00,12-802830,"General Fund Payment from Wildland Fire Management, Forest Service Cooperative Fund",N
0,00,12-803920,"Earnings on Investments, Land between the Lakes Trust Fund",N
0,00,12-804610,"Transfers from General Fund of Amounts Equal to Certain Customs Duties, Reforestation Trust Fund",N
0,00,12-810010,"Payments from General Fund, Wool Research, Development, and Promotion Trust Fund",N
0,00,12-813710,"Deposits of Fees, Inspection and Grading of Farm Products, Food Safety and Quality Service",N
0,00,12-816110,"Excise Taxes for Tobacco Assessments, Tobacco Trust Fund",N
0,00,12-820310,"Gifts and Bequests, Departmental Administration",N
0,00,12-821410,"Deposits of Miscellaneous Contributed Funds, Science and Education Administration",N
0,00,12-822610,"Deposits of Miscellaneous Contributed Funds, APHIS",N
0,00,12-823210,"Deposits of Miscellaneous Contributed Funds, Foreign Agricultural Service.",N
0,00,12-977210,Miscellaneous Contributed Funds,N
0,03,12-9913,Office of the Secretary,N
0,03,12-8203,Gifts and Bequests,N
0,04,12-9914,Executive Operations,N
0,04,12-0113,Common Computing Environment,N
0,04,12-4609,Working Capital Fund,N
0,09,12-0123,Office of the Chief Economist,N
0,11,12-0706,National Appeals Division,N
0,07,12-3800,Office of Civil Rights,N
0,05,12-9915,Departmental Administration,N
0,05,12-0500,Hazardous Materials Management,N
0,05,12-0117,Agriculture Buildings and Facilities and Rental Payments,N
0,06,12-0150,Office of Communications,N
0,08,12-0900,Office of Inspector General,N
0,10,12-2300,Office of the General Counsel,N
0,13,12-1701,Economic Research Service,N
0,15,12-1801,National Agricultural Statistics Service,N
0,18,12-1400,Salaries and Expenses,N
0,18,12-1401,Buildings and Facilities,N
0,18,12-8214,Miscellaneous Contributed Funds,N
0,20,12-1502,Integrated Activities,N
0,20,12-1003,Biomass Research and Development,N
0,20,12-1500,Research and Education Activities,N
0,20,12-1501,Buildings and Facilities,N
0,20,12-0502,Extension Activities,N
0,32,12-1600,Salaries and Expenses,N
0,32,12-1601,Buildings and Facilities,N
0,32,12-9971,Miscellaneous Trust Funds,N
0,35,12-3700,Salaries and Expenses,N
0,35,12-8137,"Expenses and Refunds, Inspection and Grading of Farm Products",N
0,37,12-2400,Salaries and Expenses,N
0,37,12-4050,Limitation on Inspection and Weighing Services Expenses,N
0,45,12-2500,Marketing Services,N
0,45,12-2501,Payments to States and Possessions,N
0,45,12-5070,Perishable Agricultural Commodities Act Fund,N
0,45,12-5209,"Funds for Strengthening Markets, Income, and Supply (section 32)",N
0,45,12-8015,"Expenses and Refunds, Inspection and Grading of Farm Products",N
0,45,12-8412,Milk Market Orders Assessment Fund,N
0,47,12-2707,Administrative and Operating Expenses,N
0,47,,Corporations,N
0,47,12-5529,Federal Crop Insurance User Fee Account,N
0,47,12-4085,Federal Crop Insurance Corporation Fund,N
0,49,12-0600,Salaries and Expenses,N
0,49,12-0170,State Mediation Grants,N
0,49,12-1144,Discrimination Claims Settlement,N
0,49,12-2701,USDA Supplemental Assistance,N
0,49,12-3317,"Aquaculture Assistance, Recovery Act",N
0,49,12-3305,Reforestation Pilot Program,N
0,49,12-3316,Emergency Conservation Program,N
0,49,12-0171,Emergency Forest Restoration Program,N
0,49,12-3304,Grassroots Source Water Protection Program,N
0,49,12-1140,Agricultural Credit Insurance Fund Program Account,N
0,49,12-4212,Agricultural Credit Insurance Fund Direct Loan Financing Account,N
0,49,12-4213,Agricultural Credit Insurance Fund Guaranteed Loan Financing Account,N
0,49,12-4140,Agricultural Credit Insurance Fund Liquidating Account,N
0,49,12-4336,Commodity Credit Corporation Fund,N
0,49,12-1336,Commodity Credit Corporation Export Loans Program Account,N
0,49,12-4337,Commodity Credit Corporation Export Guarantee Financing Account,N
0,49,12-4338,Commodity Credit Corporation Guaranteed Loans Liquidating Account,N
0,49,12-3301,Farm Storage Facility Loans Program Account,N
0,49,12-4158,Farm Storage Facility Direct Loan Financing Account,N
0,49,12-3303,Emergency Boll Weevil Loan Program Account,N
0,49,,Apple Loans Program Account,N
0,49,12-4221,Emergency Boll Weevil Direct Loan Financing Account,N
0,49,12-5531,Agricultural Disaster Relief Fund,N
0,49,12-1143,Repayable Advances to Agricultural Disaster Relief Fund,N
0,49,12-8161,Tobacco Trust Fund,N
0,53,12-1000,Conservation Operations,N
0,53,12-1004,Farm Security and Rural Investment Programs,N
0,53,12-1072,Watershed and Flood Prevention Operations,N
0,53,12-1002,Watershed Rehabilitation Program,N
0,53,12-1010,Resource Conservation and Development,N
0,53,12-1090,Healthy Forests Reserve Program,N
0,53,12-2268,Great Plains Conservation Program,N
0,53,12-3336,Forestry Incentives Program,N
0,53,12-3320,Water Bank Program,N
0,53,12-3318,Colorado River Basin Salinity Control Program,N
0,53,12-1080,Wetlands Reserve Program,N
0,53,12-3322,Wildlife Habitat Incentives Program,N
0,53,12-8210,Miscellaneous Contributed Funds,N
0,55,12-0403,Salaries and Expenses,N
0,55,12-0400,Rural Community Advancement Program,N
0,63,12-1953,Rural Housing Assistance Grants,N
0,63,12-1954,Farm Labor Program Account,N
0,63,12-0137,Rental Assistance Program,N
0,63,12-2002,Multifamily Housing Revitalization Program Account,N
0,63,12-4269,Multifamily Housing Revitalization Direct Loan Financing Account,N
0,63,12-2006,Mutual and Self-help Housing Grants,N
0,63,12-1951,Rural Community Facilities Program Account,N
0,63,12-4225,Rural Community Facility Direct Loans Financing Account,N
0,63,12-4228,Rural Community Facility Guaranteed Loans Financing Account,N
0,63,12-2081,Rural Housing Insurance Fund Program Account,N
0,63,12-4215,Rural Housing Insurance Fund Direct Loan Financing Account,N
0,63,12-4216,Rural Housing Insurance Fund Guaranteed Loan Financing Account,N
0,63,12-4141,Rural Housing Insurance Fund Liquidating Account,N
0,65,12-2073,Energy Assistance Payments,N
0,65,12-0402,Rural Empowerment Zones and Enterprise Communities Grants,N
0,65,12-1900,Rural Cooperative Development Grants,N
0,65,12-3105,Rural Economic Development Grants,N
0,65,12-1955,Rural Microenterprise Investment Program Account,N
0,65,12-4354,Rural Microenterprise Investment Direct Loan Financing Account,N
0,65,12-1902,Rural Business Program Account,N
0,65,12-4223,Rural Business and Industry Direct Loans Financing Account,N
0,65,12-4227,Rural Business and Industry Guaranteed Loans Financing Account,N
0,65,12-2069,Rural Development Loan Fund Program Account,N
0,65,12-4219,Rural Development Loan Fund Direct Loan Financing Account,N
0,65,12-4233,Rural Development Loan Fund Liquidating Account,N
0,65,12-3108,Rural Economic Development Loans Program Account,N
0,65,12-4176,Rural Economic Development Direct Loan Financing Account,N
0,65,12-1907,Rural Business Investment Program Account,N
0,65,12-4033,Rural Business Investment Program Guarantee Financing Account,N
0,65,12-1908,Rural Energy for America Program,N
0,65,12-4267,Rural Energy for America Guaranteed Loan Financing Account,N
0,65,12-3106,Biorefinery Assistance Program Account,N
0,65,12-4355,Biorefinery Assistance Guaranteed Loan Financing Account,N
0,65,12-4144,Alternative Agricultural Research and Commercialization Corporation Revolving Fund,N
0,65,12-4202,National sheep industry improvement center revolving fund,N
0,60,12-2042,High Energy Cost Grants,N
0,60,12-1980,Rural Water and Waste Disposal Program Account,N
0,60,12-4226,Rural Water and Waste Disposal Direct Loans Financing Account,N
0,60,12-4218,Rural Water and Waste Water Disposal Guaranteed Loans Financing Account,N
0,60,12-1230,Rural Electrification and Telecommunications Loans Program Account,N
0,60,12-4208,Rural Electrification and Telecommunications Direct Loan Financing Account,N
0,60,12-4209,Rural Electrification and Telecommunications Guaranteed Loans Financing Account,N
0,60,12-4230,Rural Electrification and Telecommunications Liquidating Account,N
0,60,12-1231,Rural Telephone Bank Program Account,N
0,60,12-4210,Rural Telephone Bank Direct Loan Financing Account,N
0,60,12-1232,"Distance Learning, Telemedicine, and Broadband Program",N
0,60,12-4146,"Distance Learning, Telemedicine, and Broadband Direct Loan Financing Account",N
0,60,12-4155,Rural Development Insurance Fund Liquidating Account,N
0,60,12-4142,Rural Communication Development Fund Liquidating Account,N
0,68,12-2900,Salaries and Expenses,N
0,68,12-1406,Trade Adjustment Assistance for Farmers,N
0,68,,FOREIGN ASSISTANCE PROGRAMS,N
0,68,12-2903,McGovern-Dole International Food for Education and Child Nutrition Program,N
0,68,12-2271,Public Law 480 Title I Ocean Freight Differential Grants,N
0,68,12-2278,Food for Peace Title II Grants,N
0,68,12-2277,Public Law 480 Title I Direct Credit and Food for Progress Program Account,N
0,68,12-4049,P.L. 480 Direct Credit Financing Account,N
0,68,12-4143,Debt Reduction—Financing Account,N
0,68,12-2274,"Expenses, Public Law 480, Foreign Assistance Programs, Agriculture Liquidating Account",N
0,84,12-3508,Nutrition Programs Administration,N
0,84,12-3505,Supplemental Nutrition Assistance Program,N
0,84,12-3537,Oil Spill Disaster SNAP,N
0,84,12-3539,Child Nutrition Programs,N
0,84,12-3510,"Special Supplemental Nutrition Program for Women, Infants, and Children (WIC)",N
0,84,12-3507,Commodity Assistance Program,N
0,96,12-1106,National Forest System,N
0,96,12-1103,Capital Improvement and Maintenance,N
0,96,12-1104,Forest and Rangeland Research,N
0,96,12-1105,State and Private Forestry,N
0,96,12-1119,Management of National Forest Lands for Subsistence Uses,N
0,96,12-1115,Wildland Fire Management,N
0,96,12-1130,Forest Service Payments to Communities,N
0,96,12-1120,FLAME Wildfire Suppression Reserve Fund,N
0,96,12-5207,Range Betterment Fund,N
0,96,12-5540,Stewardship Contracting Product Sales,N
0,96,12-9923,Land Acquisition,N
0,96,12-9921,Forest Service Permanent Appropriations,N
0,96,12-4605,Working Capital Fund,N
0,96,12-9974,Forest Service Trust Funds,N
0,96,,ADMINISTRATIVE PROVISIONS—FOREST SERVICE,N
0,SP,,GENERAL FUND RECEIPT ACCOUNTS,N
0,SP,,TITLE VII—GENERAL PROVISIONS,N
0,00,13-143500,"General Fund Proprietary Interest Receipts, not Otherwise Classified",N
0,00,13-225200,"Fees for Maps and Charts, Public, NOAA",N
0,00,13-271710,"Fisheries Finance, Negative Subsidies",N
0,00,13-271730,"Fisheries Finance, Downward Reestimates of Subsidies",N
0,00,13-275910,"Emergency Steel Guaranteed Loans, Negative Subsidies",N
0,00,13-275930,Emergency Steel Guaranteed Loans Downward Reestimates of Subsidies,N
0,00,13-276930,"Emergency Oil and Gas Guaranteed Loans, Downward Reestimates of Subsidies",N
0,00,13-322000,All Other General Fund Proprietary Receipts Including Budget Clearing Accounts,N
0,00,13-388500,Undistributed Intragovernmental Payments and Receivables from Cancelled Accounts,N
0,00,13-512010,"Fees, Fishermen's Contingency Fund",N
0,00,13-528310,"Gifts, Marine Mammal Unusual Mortality Event Fund",N
0,00,13-528410,"Permit Title Registration Fees, Limited Access System Administration Fund",N
0,00,13-536220,"Interest Earned, Environmental Improvement and Restoration Fund",N
0,00,13-539610,Digital Television Transition and Public Safety Fund,N
0,00,13-543910,"Access Fees, Western Pacific Sustainable Fisheries Fund",N
0,00,13-555010,Fisheries Conservation and Management Fund,N
0,00,13-558310,"Fisheries Enforcement Asset Forfeiture Fund, Deposits (PDF Account)",N
